,Datetime,Tweet Id,Text,Username
783,2021-07-21 17:10:52+00:00,1417894860447797249,"Good.

Dems are proving to the world that their little ""committee"" is nothing more than an anti-Republican witch hunt.

Pelosi and Schiff NEVER act in good faith &amp; have ZERO interest in a neutral/unbiased committee. I'm glad Republicans aren't falling for their BS for once! https://t.co/6ZFeDhdaDw",DonaldJTrumpJr
784,2021-07-21 16:41:52+00:00,1417887561721290753,"Pelosi wants you to believe that ADAM SCHIFF, the biggest liar in all of Congress, is qualified to serve on their little anti-Republican witch hunt committee, but not the ranking member of the Judiciary Committee or the head of the RSC. 

This whole thing is a total sham!!! https://t.co/r4jdjGYO0Z",DonaldJTrumpJr
785,2021-07-21 15:36:01+00:00,1417870990495948802,Biden’s radical ATF nominee David Chipman hates 2A supporters so much he makes fun of them as “tiger kings” on national TV and dismisses gun ownership as being for “the zombie apocalypse.” #StopChipman @SenatorTester @Sen_JoeManchin https://t.co/yYtoSJbqiv,DonaldJTrumpJr
786,2021-07-21 13:54:56+00:00,1417845551522107392,"I mean she told multiple children to kill themselves so maybe she should be. 

I understand she’s looking for the pity party and is shocked that it hasn’t come yet because she’s used to being able to do whatever she wants and have no consequences. https://t.co/PPp1RWuWMm",DonaldJTrumpJr
787,2021-07-21 12:51:13+00:00,1417829515590516740,"The media has created an environment where Dems can do their fake righteous PR stunts and be made into heroes instead of clowns. Theres no downside to them for pulling even the most hypocritical stunt. Even if they’re anything but, they get called and even call themselves “Brave” https://t.co/zsiIn3tlDG",DonaldJTrumpJr
788,2021-07-21 12:30:55+00:00,1417824408350208008,Reliable sources tell me that Bezos says this is “Just the Tip” of private space exploration https://t.co/ZLpGeJQjIc,DonaldJTrumpJr
789,2021-07-21 03:38:18+00:00,1417690371493187588,They sure did. I bet they’d rather have gotten a raise. https://t.co/6TZ1Boj9Ch,DonaldJTrumpJr
790,2021-07-21 02:52:53+00:00,1417678940882227200,Excited to read my good friend @marklevinshow’s new book American Marxism. I’m sure you’ll enjoy it as well. Get yours now. https://t.co/A1BH9oRzfQ,DonaldJTrumpJr
791,2021-07-21 01:33:25+00:00,1417658943074078720,"It appears that in “Live Free or Die” New Hampshire, @SenatorShaheen has chosen she’d rather let a gun-grabber snatch your rights &amp; leave you to die if an intruder comes to harm your family. Make it clear to Shaheen that betraying the #2A has political consequences (202) 224-2841 https://t.co/qqOGw36Tsf",DonaldJTrumpJr
792,2021-07-21 01:25:12+00:00,1417656876985196548,We are going to have to get a “Who wore it better” going!!! https://t.co/5b9zm8Iex5,DonaldJTrumpJr
793,2021-07-21 01:18:11+00:00,1417655107605389313,"I love that the media is somehow pretending that Fauci somehow won that exchange. Rand made Fauci look like the lying clown we all know he is. Anyone who bothered to read his emails knows it despite their desperate narrative. 

Nothing more that a bureaucrat in a lab coat. https://t.co/pLOKF3eLVY",DonaldJTrumpJr
794,2021-07-21 00:47:50+00:00,1417647471782776834,"The FBI would never abuse their power like that!!! Um… wait a second… 

Sorry, yea the FBI would definitely abuse their power like that. https://t.co/oSh8Xohsdl",DonaldJTrumpJr
795,2021-07-20 23:33:10+00:00,1417628683007897608,The White House ADMITTED that they are trying to force Big Tech to censor and silence Americans. Tech companies are working with the WH to shut down free speech in violation of the 1st Amendment. Demand a full investigation into Biden-Tech collusion here. https://t.co/DVOGkmWcea https://t.co/OH05cjvUz7,DonaldJTrumpJr
796,2021-07-20 23:24:15+00:00,1417626438946246663,They’re way too busy arresting grandmas for taking selfies to deal with little things like bombs. Duh. https://t.co/NgRu9lheDu,DonaldJTrumpJr
797,2021-07-20 18:41:10+00:00,1417555196721434627,"When is enough enough with this clown? He can sleep with a Chinese Spy, Lie on TV nonstop, use campaign funds for booze &amp; limos, shit himself on national TV and he's still on the Intel Comittee. WTF?!?

Swalwell spent thousands of campaign $$$ on booze etc https://t.co/BPprTXgkjx",DonaldJTrumpJr
798,2021-07-20 15:08:30+00:00,1417501679390494723,This is one of the best live take downs of CNN chief propagandist Mr Potato Head Brian Stelter. https://t.co/dsaJxPPLcK,DonaldJTrumpJr
799,2021-07-19 22:28:37+00:00,1417250049982177299,"When even @SenatorDurbin has to admit a Biden nominee has “a lot of issues,” you know it must be a BIG TIME radical. #StopChipman 

Biden's ATF pick has 'a lot of issues' says No. 2 Senate Dem leader https://t.co/zb0o8qHzZb",DonaldJTrumpJr
800,2021-07-19 21:55:11+00:00,1417241636657156100,So you’re saying under Joe Biden’s own ideal social media policy he should be removed from all platforms for spreading misinformation? https://t.co/94AWe1IjBC,DonaldJTrumpJr
801,2021-07-19 21:48:11+00:00,1417239874806091782,Biden's ATF pick has 'a lot of issues' says No. 2 Senate Dem leader https://t.co/zb0o8qHzZb via @politico,DonaldJTrumpJr
802,2021-07-19 18:16:03+00:00,1417186486609383425,"Lincoln Project Liz doesn't represent the views of actual Republican voters in Wyoming, which is why she barely raised any money in her supposed home state.

Cheney's real base of support are leftwing donors in VA/DC/CA/NY + CNN and MSNBC hosts!

https://t.co/dKmOBnjCoC https://t.co/BmFnVWyKFF",DonaldJTrumpJr
803,2021-07-19 15:51:32+00:00,1417150118873141248,"I understand the White House wants to control the internet and weaponize it for political gain here in the US, but have they made any efforts to get WiFi going in Cuba so some of the freedom loving protestors there can communicate and perhaps give us a glimpse of what’s going on?",DonaldJTrumpJr
804,2021-07-19 15:00:58+00:00,1417137394743193604,"I understand how a biased media spent the better part of a week pretending these TX house members were heroes and so brave, but it would likely help their failing credibility if they now reported how irresponsible they were etc… if this was a Republican PR stunt they’d be on it! https://t.co/xon2grAguX",DonaldJTrumpJr
805,2021-07-19 14:13:20+00:00,1417125405698449409,"West Virginia @Sen_JoeManchin could be the deciding vote on Biden’s lunatic, gun-grabbing ATF nominee David Chipman. It’s time for Manchin to decide whether he’s for the Second Amendment or not. This is the ultimate test. Call and tell him to #StopChipman (202) 224-3954 https://t.co/aLrfngFsiC",DonaldJTrumpJr
806,2021-07-19 12:52:02+00:00,1417104945275449346,Great time speaking at @TPUSA student action summit. Check it out. https://t.co/674uEXrWo7,DonaldJTrumpJr
807,2021-07-19 12:32:42+00:00,1417100082609074176,ATF Nominee David Chipman Unfit to Lead Agency  https://t.co/z9L2mHy8Q2,DonaldJTrumpJr
808,2021-07-18 15:45:38+00:00,1416786248014995464,"Pardon my cynicism, but it’s a learned response watching for the last 18 months, but is anyone wondering if they faked getting “COVID” as a way to avoid going home to do their jobs?

Given their theatrics all week would anyone be surprised? #heroes 🙄 https://t.co/I3uIFeyn5v",DonaldJTrumpJr
809,2021-07-18 15:18:35+00:00,1416779437341880328,"Because Science!!!

Kamala Harris Will Not Quarantine After Meeting Texas Democrats Infected with Coronavirus https://t.co/05h9nRGmcq",DonaldJTrumpJr
810,2021-07-18 13:18:09+00:00,1416749132874649603,".@pdoocy since you’re the only one in the White House press pool that doesn’t just sit there nodding like a lap dog could you ask if WH will report MSDNC, CNN, &amp; all the Dems in Congress to Facebook for removal for spreading misinformation on Russian collusion? If not why not?",DonaldJTrumpJr
811,2021-07-18 04:05:38+00:00,1416610085133070344,WTF kind of headline is that???? https://t.co/DnleKvDc28,DonaldJTrumpJr
812,2021-07-17 19:36:26+00:00,1416481942271414272,Who says God doesn’t have a sense of humor? #getwellsoon https://t.co/uzkbkn80AS,DonaldJTrumpJr
813,2021-07-17 13:28:31+00:00,1416389353480331269,"Under the White House’s new social media ideal (where WH can help dictate who should be thrown off of platforms to the platforms) will they ban from social all those in government/media who told us Russia Collision was real for 3 years? 

Was that not MISINFORMATION?
Their rules!",DonaldJTrumpJr
814,2021-07-16 19:40:01+00:00,1416120455061295106,"Question, under the White House’s new proposed social media ideals will all those who though the Wuhan Lab Leak Theory was a very plausible explanation to the start of the pandemic get their accounts back and will those who chastised and censored them be thrown off all platforms?",DonaldJTrumpJr
815,2021-07-16 14:17:39+00:00,1416039330867417090,This is terrible. I had no idea that Black Women couldn’t vote. How is this not a bigger story? https://t.co/CNxjcE8kS2,DonaldJTrumpJr
816,2021-07-16 13:31:21+00:00,1416027678688169986,Literally everything is racist!!! #CancelCrosswords https://t.co/WaloteTYYI,DonaldJTrumpJr
817,2021-07-16 13:28:03+00:00,1416026848195059719,"Maybe the NFL should focus on this kind of stuff that happens WAY too often with its own players rather than jumping on every woke cause in America. 

Figure that out first and maybe you’ll have some actual credibility when selling the other BS. https://t.co/oXTVufbgWE",DonaldJTrumpJr
818,2021-07-16 13:06:52+00:00,1416021517456969732,+\- 1000% https://t.co/BBy79E4Tbw,DonaldJTrumpJr
819,2021-07-16 12:33:14+00:00,1416013052823195649,"Because of course he did. See the pattern yet?

Hunter Biden’s prosecutor rejected moves that would have revealed probe earlier. https://t.co/8kLVuFEtzn",DonaldJTrumpJr
820,2021-07-16 11:37:16+00:00,1415998968065052684,"Sure they couldn’t😉😉😉

Does anyone still believe these people aren’t all in on it and as crooked as Hillary??? https://t.co/HhAoiU7QnE",DonaldJTrumpJr
821,2021-07-16 00:47:41+00:00,1415835495507107841,"HUH, NO SHIT!?! 

These clowns are a disgrace. https://t.co/0HokOfYC35",DonaldJTrumpJr
822,2021-07-15 23:49:39+00:00,1415820890181361666,"I’m told @RichardGrenell will be announcing his decision on whether or not he’s running in the CA Recall tonight on @SeanHannity.

Looking forward to hearing his decision. Whatever he does, I know he’s committed to Fixing California!",DonaldJTrumpJr
823,2021-07-15 22:43:50+00:00,1415804327831261195,"The hacks in the pocket of Big Tech, who defend their censorship of conservatives, want us to believe that these are just ""private companies"" operating in the ""free market,"" yet they're literally taking their censorship marching orders directly from the Federal Government!!! https://t.co/RIKwp3GjZJ",DonaldJTrumpJr
824,2021-07-15 22:00:23+00:00,1415793390709612546,The new L.A. County mask mandate is so important… It’s so vital… That they’re going to wait three days to implement it. WTF https://t.co/mqeH9wIPxZ,DonaldJTrumpJr
825,2021-07-15 20:52:51+00:00,1415776395247198211,"David Chipman is an anti-gun radical. He wants to ban AR-15s &amp; supports GUN CONFISCATION.

Any Democrat who supports his nomination can never call themself a ""moderate"" again.

Breitbart: Sean Parnell Rips Conor Lamb’s Support of ATF Nominee David Chipman

https://t.co/TvAwU0fVzN",DonaldJTrumpJr
826,2021-07-14 23:06:27+00:00,1415447632365998080,"Watch this anti-gun fanatic that Joe Biden thinks should run the ATF. Surely @Sen_JoeManchin @SenatorTester @SenAngusKing &amp; @SenatorSinema won't betray their pro-Second Amendment constituents and confirm this guy, right? Everyone should ask them. #StopChipman #2A https://t.co/i2ioZSWdd2",DonaldJTrumpJr
827,2021-07-14 21:10:35+00:00,1415418472998346752,"DHS Secretary Mayorkas does not want legitimate asylum-seekers fleeing Cuba to come to the US despite his family having done just that.

Apparently he only wants people pretending to need asylum because those people will still vote for socialist Democrats! https://t.co/kEWczqyG7R",DonaldJTrumpJr
828,2021-07-14 20:10:31+00:00,1415403354415640584,"#StopChipman Fact of the Day: During an interview with Chris Matthews (remember him? 😂), Biden’s radical ATF nominee David Chipman advocated even disarming the Secret Service, saying their “use of guns” is “not necessary.” So what do you think he'd do with YOUR guns?",DonaldJTrumpJr
829,2021-07-14 20:00:01+00:00,1415400714340290563,"I mean really??? This is why you need to get involved in local politics. So people like this (allegedly) don’t make decisions for you and your family!

BLM activist accused of molesting 62 kids returns to school board despite ongoing investigation  https://t.co/OLf9xXKpMB",DonaldJTrumpJr
830,2021-07-14 19:32:52+00:00,1415393881034792961,Seems like a publication called “Politico” would already know that and if they were intellectually honest and not partisan hacks would likely include that basic fact in their click bait… but who are we kidding?!? https://t.co/J2tR6tFUIx,DonaldJTrumpJr
831,2021-07-14 19:16:05+00:00,1415389656619917322,"The media: Lightening is obviously racist!!!

Also the media: It must have been WHITE lightening. 

Also probably the media: Lightening is a symbol of white supremacy!!!

How long till they go there? You know it’s coming. https://t.co/O3zvS5Tjr0",DonaldJTrumpJr
832,2021-07-14 18:55:10+00:00,1415384394538405892,"A bonafide war hero like @SeanParnellUSA, who has literally shed blood defending this country, has absolutely earned the right to say what he thinks about Biden/inflation, without being ""fact checked"" for ""missing context"" by leftwing partisans in Silicon Valley.

Disgraceful!!! https://t.co/iAviKQHQyt",DonaldJTrumpJr
833,2021-07-14 16:50:36+00:00,1415353043982458886,Because they’ve seen the evils of socialism and will not likely vote for Democrats. That’s why. https://t.co/SMjJOtVPhh,DonaldJTrumpJr
834,2021-07-14 15:24:25+00:00,1415331358021492740,This is a real tax on the middle class. This will hurt many families badly. https://t.co/bGGQrjQdEc,DonaldJTrumpJr
835,2021-07-14 14:34:57+00:00,1415318906336600069,"Radical Democrats are trying to end the filibuster because they know that the only way they can push their insane agenda on hardworking Americans is by changing the rules. 

Don’t let them do it. Sign the petition to help save the filibuster! https://t.co/kdNVBeulvV",DonaldJTrumpJr
836,2021-07-14 13:03:22+00:00,1415295860741652480,"Given that they want people to believe that this was the “most secure election of all time,” shouldn’t Biden WANT the audits to happen, to prove the doubters wrong? https://t.co/pU45Mm6DLm",DonaldJTrumpJr
837,2021-07-14 12:55:26+00:00,1415293862940131335,"Watching Cuban Dictator @DiazCanelB openly called on his thugs to kill unarmed protestors and children in the streets should remind us all why we cannot turn our backs on the Second Amendment ever! 

It “Shall not be infringed” for a reason!!!",DonaldJTrumpJr
838,2021-07-14 12:49:06+00:00,1415292268274192385,"It’s almost like a higher power is telling us something. 

When was the last time you heard of a brick building being destroyed by lightning? I am a builder and I’m not sure I’ve ever heard of it. https://t.co/6l1f2t9nd0",DonaldJTrumpJr
839,2021-07-14 11:27:17+00:00,1415271677718585347,Do people still take this clown seriously? https://t.co/3WG7o5UjRW,DonaldJTrumpJr
840,2021-07-14 11:24:36+00:00,1415271005212270593,It’s almost like the leftists pushing this CRT crap were lying to us all along!?! https://t.co/H6AL9KmJvQ,DonaldJTrumpJr
841,2021-07-13 21:46:08+00:00,1415065030396194816,"Wrong! It’s way beyond hyperbole… In fact, it’s total bullshit! https://t.co/P92cUkILNf",DonaldJTrumpJr
842,2021-07-13 21:44:20+00:00,1415064577700675589,Don Jr. Doubles Down: Fight David Chipman Confirmation to Save 2A https://t.co/FA1LNeFjbF,DonaldJTrumpJr
843,2021-07-13 20:57:18+00:00,1415052742188535812,Radical leftists are trying to consolidate power &amp; destroy our democracy spending millions on a propaganda campaign to end the filibuster. They know they can only pass their extreme agenda by changing the rules. Sign the petition to save the filibuster now https://t.co/kdNVBeulvV,DonaldJTrumpJr
844,2021-07-13 17:22:23+00:00,1414998654121820170,"🚨🚨🚨

An Intel Committee Congressman Who Pushed The Russia Collusion Hoax Is Invested In Chinese Communist Party-Led Companies.

https://t.co/UgzyuXbMWm",DonaldJTrumpJr
845,2021-07-13 15:02:26+00:00,1414963435473936386,"Tweet @SenatorSinema and call (202) 224-4521

Tweet @SenatorTester &amp; call (202) 224-2644.

Tweet @SenAngusKing &amp; call (202) 224-5344

Tweet @SenatorHassan &amp; call (202) 224-3324

Tell them they either support 2A or Chipman. It can’t be both. #StopChipman",DonaldJTrumpJr
846,2021-07-13 15:02:25+00:00,1414963432869318662,"Dems are panicking over my CPAC speech &amp; the #StopChipman movement. They’re trying to rush a vote on Biden’s radical, anti-Second Amendment ATF nominee David Chipman. Every senator needs to know that if they betray 2A, they will pay. See the thread below to make your voice heard https://t.co/02EA4IEmkm",DonaldJTrumpJr
847,2021-07-12 23:53:44+00:00,1414734754776236037,#StopChipman fact of the day: Biden’s ATF nominee David Chipman is a literal gun grabber. He openly supports sending Feds to your house to confiscate lawfully owned firearms once new restrictions are put in place. https://t.co/xZmftt3eQF,DonaldJTrumpJr
848,2021-07-12 13:11:20+00:00,1414573090202427397,"But the mayors office is tell us that crime there is actually down. 

Likely because cops aren’t allowed to do their jobs and enforce rules. But hey seems to be going great. Let’s keep defunding the police!!!! https://t.co/gMcgDLzBgX",DonaldJTrumpJr
849,2021-07-12 12:59:36+00:00,1414570134652456960,If you read one thread this week make it this one. https://t.co/K1C9a7sjD0,DonaldJTrumpJr
850,2021-07-12 12:48:38+00:00,1414567376109113347,How dare they wave a symbol of white supremacy!!!! That’s how this works right? https://t.co/ULfz0ltz5w,DonaldJTrumpJr
851,2021-07-12 12:44:12+00:00,1414566261942538241,"The FBI wants you to spy on your family but isn’t at all concerned about a years worth of rioting, looting, arson &amp; murder. The distrust their incompetent leadership is creating is likely irreversible.

They target grandmas taking selfie’s but not people placing bombs at the RNC. https://t.co/MpoRn0wY15",DonaldJTrumpJr
852,2021-07-11 19:19:29+00:00,1414303348359106568,Former CNN endorsed democratic presidential contender Michael Avenatti is going to prison no. You may wanna watch my thoughts. https://t.co/pCaaHizY4M,DonaldJTrumpJr
853,2021-07-11 15:11:44+00:00,1414241000130707459,"Don Trump Jr. Trolls Leftists' Gun Ignorance, Like Biden and 'AR-14s' https://t.co/HwmdD5h45m",DonaldJTrumpJr
854,2021-07-11 04:17:45+00:00,1414076420511444999,UFC crowd goes nuts when Trump enters the stadiumwith @danawhite!!! Chants of US… USA break out. These fans and most of the fighters just get it.🇺🇸🇺🇸🇺🇸 #UFC #Ufc246 https://t.co/MG0TA2E7BY,DonaldJTrumpJr
855,2021-07-10 14:30:54+00:00,1413868334861459460,"Of course they do…
“10% for the big guy” right? https://t.co/OX9g8Vc9fg",DonaldJTrumpJr
856,2021-07-10 13:49:08+00:00,1413857827488256001,But I thought the left told me CRT isn’t actually taught in schools and it’s just a rightwing conspiracy? https://t.co/JkEpRsphEs,DonaldJTrumpJr
857,2021-07-09 23:16:33+00:00,1413638231330013195,"Joe Biden's leftwing ATF nominee David Chipman is an anti-2nd Amendment radical. 

Conservatives across the country must do everything in our power to block his nomination!!! https://t.co/tfO1qbzAtu",DonaldJTrumpJr
858,2021-07-09 23:02:11+00:00,1413634619208081414,It couldn’t have happened to a nicer guy. Michale Avenatti is going to prison! My thoughts. https://t.co/pCaaHizY4M,DonaldJTrumpJr
859,2021-07-09 19:42:28+00:00,1413584356870922241,Definitely not staged and totally organic get together. https://t.co/S11eOSGfdK,DonaldJTrumpJr
860,2021-07-09 18:19:53+00:00,1413563575709446153,Fact Check: True https://t.co/m4SpX5rHF5,DonaldJTrumpJr
861,2021-07-09 17:48:45+00:00,1413555737838641152,"David Chipman, Biden's radical ATF nominee, is a massive threat to our Second Amendment #2A rights. The Senate should reject his nomination.

#StopChipman Fact of the Day: During his recent Senate testimony, Chipman said he supports a COMPLETE ban on modern sporting rifles. https://t.co/0v00kXMeTW",DonaldJTrumpJr
862,2021-07-09 13:12:58+00:00,1413486337898934272,I guess Cuomo thinks he didn’t kill enough seniors by sending sick people with COVID back into nursing homes so now he’s trying to use guns to finish them off?!? https://t.co/pgncjPKEpW,DonaldJTrumpJr
863,2021-07-08 16:11:45+00:00,1413168941820698626,"Pretty irresponsible of a governor to want to spread gun violence amongst the elderly and then lie about it to cover up the obvious data discrepancies! 

Am I missing something here? https://t.co/pgncjPt3yo",DonaldJTrumpJr
864,2021-07-08 00:09:18+00:00,1412926733007822851,These Blue Check Morons Swore The NSA Would Never Spy On Tucker https://t.co/SCY1X0Erez,DonaldJTrumpJr
865,2021-07-07 22:42:56+00:00,1412904996119658498,"I’m sure if the Intelligence Community under @RichardGrenell was accused of spying on or illegally unmasking a CNN host, all the DC reporters would totally be giving him and the IC the benefit of the doubt. 🙄🙄🙄 https://t.co/bCWGARZ3Bo",DonaldJTrumpJr
866,2021-07-07 15:34:56+00:00,1412797286938144769,"Eric Adams won’t pursue his lawsuit against the New York City Board of Elections now that he has won his Dem primary saying…

“The lawsuit was to really safeguard the paper and the documents so that we won't have any shenanigans”

I thought there were never shenanigans?!?🤔",DonaldJTrumpJr
867,2021-07-07 15:22:31+00:00,1412794163293085702,Solid point https://t.co/aOCHqZNONG,DonaldJTrumpJr
868,2021-07-06 23:02:32+00:00,1412547542303318018,"It shouldn’t, but I can’t imagine the left giving any prominent person who was right leaning any quarter here. It would be over!

The right is losing the culture war BIGLY because they haven’t engaged in 50 years while the other side trampled them every chance they get. https://t.co/9zRe3DVbsU",DonaldJTrumpJr
869,2021-07-06 19:26:34+00:00,1412493191505448964,They’re spinning… just like their players at the sight of the flag and the sound of the anthem. https://t.co/hHnHGIVHBx,DonaldJTrumpJr
870,2021-07-06 17:50:38+00:00,1412469048542117908,There’s analogy here somewhere. https://t.co/11P02uArxd,DonaldJTrumpJr
871,2021-07-06 17:32:48+00:00,1412464561643352070,#girlpower https://t.co/hjxtS3adEr,DonaldJTrumpJr
872,2021-07-06 16:46:13+00:00,1412452838643404802,"It already is, and even you know that, but you also know that your lap dogs in the media will run your BS for clicks regardless of the facts because your ideologies are the same. Rinse and repeat… it’s the dem platform in a nutshell. https://t.co/uM9Ws4QPrh",DonaldJTrumpJr
873,2021-07-06 13:41:13+00:00,1412406282615721989,"If Democrats spent 10% of the energy that they spend trying to shut down and silence people they don’t agree with on the economy, they wouldn’t have to deal with the disaster that is looming and that they’re creating.",DonaldJTrumpJr
874,2021-07-05 20:03:18+00:00,1412140047864844296,".@DonaldJTrumpJr on Biden's economy: ""You will save an accumulative 16 cents on your barbecue. [...] That's great as long as you don't have to drive to the end of your driveway, in which case the extra dollar per gallon of fuel will eat up that 16 cents."" https://t.co/pZWydY8OQi",DonaldJTrumpJr
875,2021-07-05 02:26:52+00:00,1411874190177808385,@chasinnova1 True,DonaldJTrumpJr
876,2021-07-05 02:20:57+00:00,1411872697299111940,"Guys, I’m beginning to think there may be a slight difference in the way the media handles leaders of different parties??? https://t.co/0s27gx2LKU",DonaldJTrumpJr
877,2021-07-05 01:11:46+00:00,1411855286684557313,Hope you all had a great 4th Twitter… Even the losers and the haters that said they were moving to Canada.🇺🇸🇺🇸🇺🇸 #Happy4thofJuly #4thofJuly https://t.co/mQFm2hJCnQ,DonaldJTrumpJr
878,2021-07-04 21:31:40+00:00,1411799898404577283,"In fairness Trump did it and aced it and there weren’t daily indicators that he wasn’t all there… unlike Joe Biden. 

It’s OK they can just let him have ice cream again &amp; again and make sure to get the photo op… just don’t let him speak because you’ll want him to take the test. https://t.co/oMQq9fIbYd",DonaldJTrumpJr
879,2021-07-04 14:21:55+00:00,1411691749408448519,Imagine what the DA/AG could do if they used a few percent of the energy and recourses they expend going after their political enemies on say stuff like this??? Sad and pathetic. https://t.co/1Xkz3J5aj5,DonaldJTrumpJr
880,2021-07-04 13:45:45+00:00,1411682647433170947,Rolling into Fourth of July BBQ like a boss. #4thofJuly #FourthofJuly https://t.co/yokJLqvku4,DonaldJTrumpJr
881,2021-07-04 13:11:05+00:00,1411673924501487620,HAPPY BIRTHDAY AMERICA 🇺🇸 🇺🇸🇺🇸#IndependenceDay #4thofJuly #America #birthday,DonaldJTrumpJr
882,2021-07-04 01:08:06+00:00,1411491979129765889,@youngbiafra Thanks so much. It’s my pleasure.,DonaldJTrumpJr
883,2021-07-04 00:57:12+00:00,1411489234373033986,Where’s the lie??? https://t.co/WmtH4F5CUA,DonaldJTrumpJr
884,2021-07-04 00:52:17+00:00,1411487998328332291,Sad but true. https://t.co/xswnbpVuiT,DonaldJTrumpJr
885,2021-07-04 00:51:16+00:00,1411487740529721350,@MAGAPROUD25 Thanks,DonaldJTrumpJr
886,2021-07-04 00:51:04+00:00,1411487690500026372,@bklyngk Thanks.,DonaldJTrumpJr
