,Datetime,Tweet Id,Text,Username
452,2021-08-31 20:45:55+00:00,1432806881760849932,"Everything you need to know about Democrats, courtesy of Nancy Pelosi. 
They hate you and they hate America!

Anything that appears to be to the contrary is done for pure optics. For the Photo-Op. Just understand that! https://t.co/uo2jjHpx7Q",DonaldJTrumpJr
453,2021-08-31 20:04:03+00:00,1432796345899880449,They left the service dogs!!! 🤬🤬🤬 https://t.co/ceGx9GhiYo,DonaldJTrumpJr
454,2021-08-31 19:18:06+00:00,1432784781507448835,OMG there’s more? Well at least we got out a bunch of suspected ISIS terrorists and a rapist. Great work Joe. https://t.co/jJ9oKRxDgx,DonaldJTrumpJr
455,2021-08-31 18:40:04+00:00,1432775210747502599,"Joe Biden left a 3 year old boy from California stranded in Afghanistan to die.

This is pure evil. 

https://t.co/J8TxrSDgGl",DonaldJTrumpJr
456,2021-08-31 17:31:18+00:00,1432757903048519685,*that,DonaldJTrumpJr
457,2021-08-31 17:12:29+00:00,1432753170623651849,"Just when you think the Joe Biden and his Administration couldn't get any lower. 

What an absolute disgrace. https://t.co/N2cNvktV4C",DonaldJTrumpJr
458,2021-08-31 16:42:11+00:00,1432745544393367552,The Biden administration didn’t just abandon Americans in Afghanistan. They even abandoned hard-working service dogs!!! WTF,DonaldJTrumpJr
459,2021-08-31 15:58:01+00:00,1432734427864604672,"Remember when we had a President who honored our hero dogs and didn't leave them behind to be slaughtered? 

https://t.co/AQan0Gduqg",DonaldJTrumpJr
460,2021-08-31 15:38:24+00:00,1432729494339690507,"Looks like they’re really vetting the hell out of these people. I’m sure they’ll love living in your towns, paid for by your tax dollars. Greta job Democrats. 

Convicted rapist reached the U.S. on Afghan evacuation flight - Washington Times https://t.co/wVRYTHjzDz",DonaldJTrumpJr
461,2021-08-31 15:35:20+00:00,1432728721492938754,Seems like the most Democrat Party Policy ever!!! https://t.co/SeDtG800ON,DonaldJTrumpJr
462,2021-08-31 15:06:27+00:00,1432721451975598092,Notice the media reaction to this national disgrace is nothing compared to their response to quite literally anything Trump did.,DonaldJTrumpJr
463,2021-08-31 03:25:35+00:00,1432545072222978052,They even left the military dogs behind. #BidenMustGo,DonaldJTrumpJr
464,2021-08-31 03:18:01+00:00,1432543169095348227,"If you think Trump deserved to be impeached for a phone call, but that Joe Biden did nothing wrong your commitment to stupidity is truly impressive!",DonaldJTrumpJr
465,2021-08-31 02:21:49+00:00,1432529025235308545,I can’t wait until they seek — and prob receive — a seat on the UN Human Rights Council. https://t.co/omwQht3LP8,DonaldJTrumpJr
466,2021-08-31 02:02:48+00:00,1432524241933586434,Has a single person been fired for the gross incompetence we have witness over the past 2 weeks? Has anyone even been reprimanded? #BidenMustGo,DonaldJTrumpJr
467,2021-08-31 01:04:31+00:00,1432509572816773123,Wondering where the hell all the fact checkers went. You’d think they’d be busy AF this last two weeks but it’s like they’re in hiding… more than even our pathetic president. https://t.co/zrcWCTW5eP,DonaldJTrumpJr
468,2021-08-31 00:32:03+00:00,1432501402132230146,"Well, true to the Biden #AmericaLAST agenda, at least they got about 100,000 afghans out even if they are leaving lots of Americans behind STRANDED in a terrorist controlled country. Who cares if some are convicted rapists/suspected terrorists… they’ll love living in your towns! https://t.co/csaAY1nxdu",DonaldJTrumpJr
469,2021-08-30 23:22:36+00:00,1432483923771240448,"“President Trump brought American hostages home.

President Biden left Americans to become hostages.” 

@Rothbard1776",DonaldJTrumpJr
470,2021-08-30 21:59:29+00:00,1432463008630968321,"Does anyone have a complete understanding of how many thousands of Americans Joe Biden abandoned and left stranded in a terrorist control country? 

The Biden just administration created a hostage situation like we’ve never seen before as a country.",DonaldJTrumpJr
471,2021-08-30 21:46:50+00:00,1432459824592207875,"Absolutely terrible! It should be no surprise for Joe is not capable of doing anything without a script. He is not fit for this job.

Family of Marine killed in Afghanistan slams Biden meeting as scripted, a ‘total disregard’ to Marine’s death  https://t.co/mwEshWcr4j",DonaldJTrumpJr
472,2021-08-30 21:15:30+00:00,1432451938986217479,"Leaving American citizens for dead in a terrorist controlled country is not American… it’s treasonous. 

“America is back” my ass. https://t.co/csaAY1nxdu",DonaldJTrumpJr
473,2021-08-30 20:47:31+00:00,1432444895273308166,"So you’re saying they did not in fact “plan for every contingency?” 

Asking for what’s probably thousands of Americans left behind and stranded In Afghanistan as well as tens of thousands of our allies who are in all likelyhood about to be hunted down by ISIS/Taliban squads. https://t.co/HOOb04OtYa",DonaldJTrumpJr
474,2021-08-30 20:43:59+00:00,1432444005929963520,"General Kenneth McKenzie calls Taliban-controlled Afghanistan “our generous host nation."" 

It’s almost unfathomable what has happened to America so quickly under this administration!",DonaldJTrumpJr
475,2021-08-30 20:30:18+00:00,1432440565065555970,Pro Tip: The State Dept doesn't know either https://t.co/wyvWW3Wvnk,DonaldJTrumpJr
476,2021-08-30 20:19:50+00:00,1432437930069536770,Good luck to the Americans and our friends and allies who were apparently left behind and stranded in Afghanistan by the Biden administration. https://t.co/V4OTkq5DY1,DonaldJTrumpJr
477,2021-08-30 19:36:10+00:00,1432426939042701313,"Well since it seems the Biden Administration couldn’t be bothered to get Americans out of Afghanistan at least they’re bringing back… 

Wait for it… Convicted rapists!

I’m sure the vetting has been very thorough and none of this will be brought here. Democrat policies at work! https://t.co/NJ2TyFZd5j",DonaldJTrumpJr
478,2021-08-30 16:08:35+00:00,1432374701029052423,Its unconscionable that The United States of America is going to leave American citizens behind in Afghanistan.,DonaldJTrumpJr
479,2021-08-30 15:42:53+00:00,1432368233143799811,Do these clowns know anything? I guess if they don't know someone is there they cant leave them abandoned so they rather not find out. https://t.co/ODA8LuXqNg,DonaldJTrumpJr
480,2021-08-30 15:09:58+00:00,1432359950379102212,To fully understand the incompetence of this administration and the new woke military read and RT this!!! https://t.co/uXH3weNsxL,DonaldJTrumpJr
481,2021-08-30 14:49:32+00:00,1432354807742881797,"It’s pretty clear he was just resting his eyes for approximately 32 seconds straight while meeting with the Prime Minister of Israel.

Also, he was not checking his watch while receiving the bodies of our fallen soldiers in front of their families… He was itching his watch. https://t.co/wfGVILVgyU",DonaldJTrumpJr
482,2021-08-30 14:12:07+00:00,1432345392587345920,@DeAngelisCorey *making them significantly more likely top be effected if they get it.,DonaldJTrumpJr
483,2021-08-30 12:53:19+00:00,1432325560148049920,It’s almost like all of our adversaries on the world stage can smell the weakness emanating from Joe Biden. https://t.co/8OoWRjmWNn,DonaldJTrumpJr
484,2021-08-30 12:48:53+00:00,1432324443586564096,"What the hell is happening in this country???

""Judge James Shapiro removed Rebecca Firlit’s visitation rights with her 11-year-old son after learning that she had not yet received the vaccine.""

https://t.co/ZwNgJIzkoM",DonaldJTrumpJr
485,2021-08-30 11:13:53+00:00,1432300538343968768,"If you are an American citizen your share of the $85,000,000,000 arms package Joe Biden left to Taliban Terrorists is $265. Each and every one of you. 
This is what democrats get you. #AmericaLast",DonaldJTrumpJr
486,2021-08-30 02:03:39+00:00,1432162067348328448,Sometimes it really does feel like we’re watching the decline and collapse of a once-great nation https://t.co/x74Y38dG5c,DonaldJTrumpJr
487,2021-08-29 23:31:13+00:00,1432123704645914627,"So Joe killed a bunch of civilians to make himself look like a tough guy? 
Just imagine if this was DJT. CNN would be calling for him to be in front of The Hague. https://t.co/DKPb3moN4t",DonaldJTrumpJr
488,2021-08-29 16:40:59+00:00,1432020465699196934,“Leader” of the free world! https://t.co/cr73exCnNV,DonaldJTrumpJr
489,2021-08-29 16:06:47+00:00,1432011860866371587,It’s almost like it’s total bullshit. https://t.co/T8nj0x5msy,DonaldJTrumpJr
490,2021-08-29 15:46:20+00:00,1432006713151037440,"The one person fired in the absolute debacle we are witnessing right now in Afghanistan is a lieutenant colonel who actually questioned the idiots who made these decisions simply asking for some accountability.

No one else and I doubt anyone else will be fired! Disgraceful",DonaldJTrumpJr
491,2021-08-29 14:55:50+00:00,1431994004141395972,America is so oppressive that mothers in Afghanistan will hand their babies over to strangers with an an American Flag on their arms in hopes that their child may have a better life even if it’s not with them. 🇺🇸🇺🇸🇺🇸,DonaldJTrumpJr
492,2021-08-29 13:53:34+00:00,1431978335010177032,"For perspective… $85,000,000,000 worth of military being left to Taliban Terrorists means that each and every man, woman, and child in American contributed about $265 to their terrorist cause assuming +/-320 mil citizens. 
Well done Democrats! https://t.co/fXefvP5cNH",DonaldJTrumpJr
493,2021-08-29 13:15:36+00:00,1431968780607889409,I remember when “military leadership” wasn’t an oxymoron. It’s no wonder they can’t see the obvious coming anymore. The best bureaucrats and the absolute worst war-fighters are the ones that get promoted and make the decisions. https://t.co/DFrwd7hvq0,DonaldJTrumpJr
494,2021-08-29 12:49:52+00:00,1431962304178896900,The same government that released the names of thousands of Americans trapped behind terrorist lines in Afghanistan to the Taliban will not release a list of names of two terrorist killed by a supposed drone strike… Let that sink in and what does it tell you?,DonaldJTrumpJr
495,2021-08-29 12:22:07+00:00,1431955321535225864,"As I said a week ago, Joe Biden and his lunatic Democrat cabinet created the largest hostage situation in American History. 

tHE aDuLts aRE BacK iN cHARge!!!! https://t.co/rruHEJsv3O",DonaldJTrumpJr
496,2021-08-29 12:19:11+00:00,1431954582800719880,@JesseKellyDC Graduated high school with Nancy Pelosi.,DonaldJTrumpJr
497,2021-08-29 12:00:11+00:00,1431949800455360515,Truth!!! https://t.co/D4C6DWZgXC,DonaldJTrumpJr
498,2021-08-29 11:48:27+00:00,1431946846386024453,"Anyone else feel like we’re being catfished? 

The same people who had no idea Taliban were planning to take over the country and didn’t plan to get Americans out knew exactly where to find two specific people.

If it even happened, I’d venture they “weren’t high” profile at all! https://t.co/wwjExXu0Ml",DonaldJTrumpJr
499,2021-08-29 11:08:01+00:00,1431936672107802625,The most popular president ever seems to be doing a bang up job guys.,DonaldJTrumpJr
500,2021-08-29 10:36:10+00:00,1431928659103911942,"Same people that could never have seen the Afghanistan disaster coming were able to find two people who planned a bomb attack with a missile. 
Do not ask questions. https://t.co/Ho2gexqZWS",DonaldJTrumpJr
501,2021-08-28 20:56:03+00:00,1431722268384694276,Those Hunter no-show no-experience board seats didn’t come without an expected return! https://t.co/7rAGmf8Jnx,DonaldJTrumpJr
502,2021-08-28 20:31:07+00:00,1431715994309906444,Joe Biden’s legacy will be showing Americans how good they actually had it under Donald Trump!,DonaldJTrumpJr
503,2021-08-28 17:53:38+00:00,1431676361903640577,State department had originally said 11k Americans there so does that means they left at least 5k Americans behind? https://t.co/cOsyKBgoS2,DonaldJTrumpJr
504,2021-08-28 13:37:51+00:00,1431611991068758021,I have never heard 81 MILLION people be so quiet…,DonaldJTrumpJr
505,2021-08-27 23:24:51+00:00,1431397327969923074,"The woke generals can troll Tucker Carlson on twitter and pontificate about ""white rage"" in front of Congress, but simply asking for accountability for their deadly mistakes...gets you fired. 

What a disgrace. https://t.co/1ULXeMHXHi",DonaldJTrumpJr
506,2021-08-27 21:02:51+00:00,1431361592990519304,"They planned for every contingency!
*except for any of them. https://t.co/AVuvCB8XHn",DonaldJTrumpJr
507,2021-08-27 20:31:46+00:00,1431353768877166596,Bringing this to the top. https://t.co/FiroNcBwzx,DonaldJTrumpJr
508,2021-08-27 20:01:25+00:00,1431346130638540807,"At least they didn’t also give them lists of names to make it even easier…. Um, oh shit. NVM. https://t.co/AVuvCB8XHn",DonaldJTrumpJr
509,2021-08-27 19:52:05+00:00,1431343780607762437,Thread https://t.co/SDOCafNJYL,DonaldJTrumpJr
510,2021-08-27 19:44:23+00:00,1431341845364318217,"The same administration trying to distract you from the Afghanistan disaster by infringing more of your rights just allowed a terrorist regime to get $ billions in Machine Guns, Drones, and Blackhawk Helicopters. 

Pay attention to what they’re trying to do and don’t let them! https://t.co/7FvoqDKwTJ",DonaldJTrumpJr
511,2021-08-27 18:56:19+00:00,1431329748223934465,"Would you perhaps say that they’re STRANDED? 
Would that still be irresponsible? https://t.co/g53FSA0Zan",DonaldJTrumpJr
512,2021-08-27 18:32:10+00:00,1431323672929832962,🤣🤣🤣🤣🤣🤣🤣🤣🤣🤣🤣🤣🤣🤣🤣🤣🤣🤣🤣🤣🤣🤣🤣🤣🤣🤣🤣🤣🤣🤣🤣🤣🤣🤣🤣🤣🤣🤣🤣🤣🤣🤣🤣🤣🤣🤣🤣🤣🤣🤣🤣🤣🤣🤣🤣🤣🤣🤣🤣🤣🤣🤣🤣🤣🤣🤣🤣🤣🤣🤣🤣🤣🤣🤣🤣🤣🤣🤣🤣🤣🤣🤣🤣🤣🤣🤣🤣🤣🤣🤣🤣🤣🤣🤣🤣🤣🤣🤣🤣🤣🤣🤣🤣🤣🤣🤣🤣🤣🤣🤣🤣🤣🤣🤣🤣🤣🤣🤣🤣🤣🤣🤣🤣🤣🤣🤣🤣🤣🤣🤣🤣🤣🤣🤣🤣🤣🤣🤣🤣🤡 https://t.co/IlufpcmlTO,DonaldJTrumpJr
513,2021-08-27 18:08:39+00:00,1431317754624319495,But did you reach out to Willie Brown for comment too? https://t.co/KQPYlDLQ9Y,DonaldJTrumpJr
514,2021-08-27 17:34:40+00:00,1431309199988989958,"According to the pentagon, The Taliban released thousands of ISIS prisoners, but also according to the pentagon the Taliban dont like ISIS and it was ISIS not the Taliban that attacked the airport. 👍",DonaldJTrumpJr
515,2021-08-27 16:52:01+00:00,1431298467452882947,"“In 7 months, our counterterrorism posture went from “Fuck around and find out” to “The Taliban has assured us…” @BobSalera 

Joe Biden is a disgrace.",DonaldJTrumpJr
516,2021-08-27 16:31:10+00:00,1431293220407975940,"Sadly, we all know that Biden isn't hunting anything down, except another scoop of ice cream. https://t.co/KLmhnWQpGB",DonaldJTrumpJr
517,2021-08-27 16:26:44+00:00,1431292102755901444,"Nailed it @SeanParnellUSA 

Daily Caller: Sean Parnell Blasts Biden On Afghanistan, Says He ‘Basically Installed A Global Jihadist All-Star Team’

https://t.co/34gMpQEcpv",DonaldJTrumpJr
518,2021-08-27 15:59:29+00:00,1431285245362511874,At this point it would be hard to imagine anyone other than China. https://t.co/gBcE8wMxXA,DonaldJTrumpJr
519,2021-08-27 13:41:20+00:00,1431250478302650384,"Imagine putting out a statement essentially saying we have no intention of fighting back while we are still in the midst of the evacuation?

Literally projecting to ISIS Terrorists that they can have free reign with no consequence. 

Your Woke Military At Work Folks. https://t.co/6SexnwXqEB",DonaldJTrumpJr
520,2021-08-27 13:29:57+00:00,1431247616482889732,Who could have possibly thought that knocking on wood would not in fact be a great strategy for the Afghan withdrawal? https://t.co/9eSrJxhwLg,DonaldJTrumpJr
521,2021-08-27 13:05:52+00:00,1431241554178498566,"The Biden Administration gave the Taliban a list of Americans still in country. 

They gave a Terrorist organization that they have said on the record that they DO NOT TRUST a kill list. Let that sink in.",DonaldJTrumpJr
522,2021-08-27 12:46:09+00:00,1431236592774045696,"7 months down 41 to go. 
Great job America!!!",DonaldJTrumpJr
523,2021-08-27 12:10:30+00:00,1431227621434658820,"Predators prey on the weak… it doesn’t matter if you’re an animal in the wild or the President of The United States. 

That’s just the natural order of things. 

We're now all seeing the real world consequences of Joe Biden's weakness. #FollowTheScience",DonaldJTrumpJr
524,2021-08-27 03:06:31+00:00,1431090723609251842,If America doesn’t get it now they never will.,DonaldJTrumpJr
525,2021-08-27 02:11:06+00:00,1431076777250762759,Giving enemy terrorists a list of Americans in a territory that they control is treason!,DonaldJTrumpJr
526,2021-08-27 01:47:45+00:00,1431070900561010692,"The Biden administration gave the Taliban a list of Americans and our allies still in country!!!

I literally cannot fathom the level of incompetence that we are seeing from our leaders it’s absolutely disgusting. 
#Treason",DonaldJTrumpJr
527,2021-08-27 01:36:24+00:00,1431068046173642756,My father says what Joe Biden isn’t capable of. I hope our vets watch this so they know all their sacrifices over the last 20 years were not in vain. https://t.co/NH64a6frT5,DonaldJTrumpJr
528,2021-08-26 22:02:11+00:00,1431014133789597703,"RT if you agree!!!

""Joe Biden and his team have been more concerned with protecting their own political asses than protecting our citizens...He needs to be removed as Commander in Chief"" - @SeanParnellUSA 

https://t.co/SqRTBdERCH",DonaldJTrumpJr
529,2021-08-26 21:53:10+00:00,1431011866080419840,This is what weakness looks like. https://t.co/a7vqlqYUhU,DonaldJTrumpJr
530,2021-08-26 21:45:57+00:00,1431010050001313799,"Is Joe Biden really claiming that most of the Americans stranded in Afghanistan don't want to come home???

25th Amendment right now.",DonaldJTrumpJr
531,2021-08-26 21:35:30+00:00,1431007420520796165,Our amazing and brave soldiers never signed up to be sacrificed by their Commander in Chief's incompetence.,DonaldJTrumpJr
532,2021-08-26 21:28:55+00:00,1431005763963588612,Joe Biden is a disgrace. Pass it on.,DonaldJTrumpJr
533,2021-08-26 20:46:54+00:00,1430995188336545797,"This is 100% right, but it's not just Biden who needs to resign.

Blinken, Austin, Milley, Sullivan and Klain all own this disgrace too and need to go!!!! https://t.co/1HVgHtB0tO",DonaldJTrumpJr
534,2021-08-26 20:42:37+00:00,1430994111587311616,"So now we are giving a terrorist organization the names of US citizens and other allies? How does this not endanger them greatly? 

We impeach presidents for having a phone call with a president of another country but not this insanity! You awake yet? https://t.co/1tmIFHpo1D",DonaldJTrumpJr
535,2021-08-26 19:34:23+00:00,1430976938760343554,"The JV Team is back. 

And I mean both ISIS and Biden.",DonaldJTrumpJr
536,2021-08-26 18:03:42+00:00,1430954117825015808,"We had the intel capabilities to say today's bombing was ""imminent"" near the airport gates but Biden didn't know that 60,000 Taliban fighters were coming down the highways last month? Does anyone believe that?",DonaldJTrumpJr
537,2021-08-26 15:35:59+00:00,1430916944740372485,This!!!! https://t.co/k3VXpWAad6,DonaldJTrumpJr
538,2021-08-26 14:38:35+00:00,1430902501570613251,So are we talking about impeachment yet? Asking for a friend who was impeached for a phone call but definitely wouldn’t strand thousands of American Civilians behind terrorist enemy lines! #BidenDisaster,DonaldJTrumpJr
539,2021-08-26 13:33:36+00:00,1430886147497070592,We need @HerschelWalker in the Senate. No one will fight harder for our America First movement!!! https://t.co/lIOq5zHM0J,DonaldJTrumpJr
540,2021-08-25 21:17:26+00:00,1430640484607795206,Wow. Re-education? Already? This is all happening faster than anyone could have imagined. https://t.co/xehjAU7Krm,DonaldJTrumpJr
541,2021-08-25 19:52:30+00:00,1430619109641830401,Joe Biden is clueless. His handlers won’t let him take questions from the press. And the media lets him get away with it. DEMAND the media DO THEIR JOB and hold Biden accountable. https://t.co/Iv8VKliPPx,DonaldJTrumpJr
542,2021-08-25 18:33:25+00:00,1430599207795179524,Definitely the man in charge guys. https://t.co/NdmiZWls1u,DonaldJTrumpJr
543,2021-08-25 18:07:30+00:00,1430592686885584900,"But I was told…. 

Also who the hell takes a summer trip to Afghanistan? https://t.co/QxtcEdvpJx",DonaldJTrumpJr
544,2021-08-25 17:54:58+00:00,1430589531741466626,"MEXICO has done more than Joe Biden to get Americans out of Afghanistan! 

How Mexico Helped The Times Get Its Journalists Out of Afghanistan - The New York Times https://t.co/iFnbFOY9Yy",DonaldJTrumpJr
545,2021-08-25 17:16:15+00:00,1430579791091093516,"Biden is really taking his America Last policies to a whole new level! #AmericaLast

Only 5 Percent Of US Evacuees From Afghanistan Are Americans https://t.co/jxZgHRX6Oc",DonaldJTrumpJr
546,2021-08-25 17:02:29+00:00,1430576325278982146,Have the Taliban give Biden any more orders since yesterday?,DonaldJTrumpJr
547,2021-08-25 15:41:10+00:00,1430555860036722693,"Also, I can’t believe Ron DeSantis did this. https://t.co/IkBlO9eBvb",DonaldJTrumpJr
548,2021-08-25 15:31:52+00:00,1430553519967424521,"The new Governor of New York just announced that an additional 12,000 previously undisclosed COVID deaths occurred under Gov Cuomo. That’s almost four 9/11s under the Dem’s units of measurement. 

Will there be criminal charges brought now for Cuomo’s deadly nursing home coverup?",DonaldJTrumpJr
549,2021-08-25 15:15:50+00:00,1430549484577169416,"Everyone in the media knew they just didn’t want to dig in or report it so as not to hurt a 2024 Democrat hopeful. 
That’s the state of journalism today. https://t.co/guKLUZa4MS",DonaldJTrumpJr
550,2021-08-25 15:05:25+00:00,1430546865028833286,"15 days to stop the spread… J/K I meant 15 years or as long as you give me the attention I so desperately want! 
Fauci Probably. https://t.co/wWh1Uv8NK2",DonaldJTrumpJr
551,2021-08-25 12:41:53+00:00,1430510743183626242,"I was told it’s irresponsible to say there are any Americans stranded? I guess if Biden just doesn’t acknowledge them they don’t exist? 

American mom trapped by Taliban describes horrific violence, pleads for Biden to solve evacuation crisis.  https://t.co/Sg3bQZo9LK",DonaldJTrumpJr
552,2021-08-25 12:03:50+00:00,1430501168363544577,They impeached Trump over a phone call but stranding thousands of Americans in a terrorist controlled country is just fine.,DonaldJTrumpJr
553,2021-08-25 02:04:39+00:00,1430350379544420357,"If China were to hatch a plan from within the United States to weaken us on the global stage, make our allies question our allegiances and our resolve, and embolden our enemies… Could they possibly do any better than what Joe Biden is currently doing? #BidenIsADisgrace",DonaldJTrumpJr
554,2021-08-25 01:48:43+00:00,1430346367835197441,Just imagine if it was Trump…https://t.co/IyLaQSpGdv,DonaldJTrumpJr
555,2021-08-25 00:28:03+00:00,1430326066913157121,For those Joe Biden has left stranded in a hell hole! https://t.co/AwzP6ybAi4,DonaldJTrumpJr
556,2021-08-24 23:54:49+00:00,1430317704808968197,Bringing this to the top since I was about a week ahead of all the pundits now saying this is a Taliban Hostage Crisis. https://t.co/zuusS1jVmN,DonaldJTrumpJr
557,2021-08-24 23:28:38+00:00,1430311115653894145,"Am hearing that Team Biden is finally planning on playing hardball with the Taliban. 

Reliable sources tell me that Biden &amp; our woke Generals will DEMAND that the Taliban rename themselves the LGBTaliban+ to be more inclusive &amp; diverse, or else no more American weapons for them!",DonaldJTrumpJr
558,2021-08-24 22:07:07+00:00,1430290602697138178,No one can be this incompetent… Who is actually pulling the strings? Who has this kind of control over Biden? These are questions we have to start asking! https://t.co/koPAEmO9qW,DonaldJTrumpJr
559,2021-08-24 22:03:08+00:00,1430289597586710531,Biden surrendered Afghanistan and is leaving thousands of American citizens stranded there in the process...but no mean tweets guys 🙄🙄🙄 https://t.co/ytQLxTtDEq,DonaldJTrumpJr
560,2021-08-24 21:09:12+00:00,1430276026630815745,"Thousands of American citizens are stranded behind enemy lines in Afghanistan with no way to get out and Joe Biden starts his speech to the nation by pitching his leftwing political agenda.

What an absolute disgrace!!! https://t.co/GyCFHXgMup",DonaldJTrumpJr
561,2021-08-24 18:50:13+00:00,1430241048782151682,Totally normal stuff guys. People better start paying attention because this doesn’t end well in my opinion. https://t.co/D2ZC2ZZuJI,DonaldJTrumpJr
562,2021-08-24 17:07:21+00:00,1430215163978846209,"I was told there are no Americans stranded in Afghanistan by the Press Sect just yesterday. Was she lying???
Why are there no fact checkers all over this? https://t.co/PQw6fSTzEY",DonaldJTrumpJr
563,2021-08-24 13:41:19+00:00,1430163314445852677,"What a disgrace, the Taliban has made Joe Biden and the Democrats and unfortunately our country in the process the laughing stock of the world! https://t.co/FKXVbbdhF0",DonaldJTrumpJr
564,2021-08-24 13:39:55+00:00,1430162961914638339,"Clinton lackey Terry McAuliffe supports discriminating against law-abiding American citizens. 

He's a total disgrace. https://t.co/9aXotCVKyO",DonaldJTrumpJr
565,2021-08-24 12:27:53+00:00,1430144832371052550,Why is Biden prioritizing afghans over American citizens? It’s America Last with the democrats as always. #BidenIsADisgrace https://t.co/B3P7dOoX3w,DonaldJTrumpJr
