,Datetime,Tweet Id,Text,Username
0,2021-12-12 15:36:01+00:00,1470054841762332672,"New York liberals just did the unthinkable: Passed a law allowing NON CITIZENS to vote. Let's DEMAND the courts strike down this anti-American law. 
Sign up now and say enough is enough!!! https://t.co/Haad1dyVO4",DonaldJTrumpJr
1,2021-12-11 21:34:31+00:00,1469782674852265984,I heard from reliable inside sources that Joe Biden is not going to Army/Navy Game to avoid the Let’s Go Brandon chants!,DonaldJTrumpJr
2,2021-12-10 21:38:52+00:00,1469421382438199297,"NYC liberals just did the unthinkable: Passed a law allowing NON CITIZENS to vote. Let's DEMAND the courts strike down this anti-American law. 
Sign up now and say enough is enough!!! https://t.co/Haad1dyVO4",DonaldJTrumpJr
3,2021-12-10 14:51:35+00:00,1469318883215618054,I was told the media was just being super unfair to Biden just yesterday? Guess not. Economy is going great guys. Nothing to see here just one day later. https://t.co/6jDjjgp7xE https://t.co/DLY6oZLzw3,DonaldJTrumpJr
4,2021-12-10 14:40:51+00:00,1469316182121590787,"Yea, I called this one really early. We all thought it but I said it out loud. It was so obvious and they tried to go after me but I stuck to my guns and doubled down. There’s a lesson here if you’re unafraid. https://t.co/euVzY7ttri",DonaldJTrumpJr
5,2021-12-10 01:12:54+00:00,1469112857375776773,He was right after all!!! https://t.co/EfhmtemdS5,DonaldJTrumpJr
6,2021-12-10 00:55:59+00:00,1469108597820899330,How long until CNN labels the Smollett jury white supremacists?,DonaldJTrumpJr
7,2021-12-10 00:04:55+00:00,1469095750097383430,"I’m just happy to live in a country where people will go to jail for attacking a gay black man... 
There’s absolutely no place for that shit in America, or anywhere else, and I am happy the perpetrator was brought to justice.",DonaldJTrumpJr
8,2021-12-09 23:45:44+00:00,1469090921425817601,"I’m with you Al, I think all of America is with you on this one. 

The guilty must face the maximum. https://t.co/r8mBoyRuRi",DonaldJTrumpJr
9,2021-12-09 23:33:25+00:00,1469087819595407364,We finally got #justiceforjussie,DonaldJTrumpJr
10,2021-12-09 18:21:10+00:00,1469009241008750594,"Biden is a Russian Stooge! That’s how this works, right? Also, unfortunately, in this case it seems real unlike the Russia Russia Russia BS of the last 5 years. 

REPORT: Biden Admin Plans On Advising Ukraine To Hand Over Territory To Russia https://t.co/Alzd7CE2TC",DonaldJTrumpJr
11,2021-12-09 16:02:52+00:00,1468974437911314433,Yes he is that dumb! https://t.co/gWEosdtGGf,DonaldJTrumpJr
12,2021-12-09 03:18:29+00:00,1468782072915382273,I wonder why??? https://t.co/36CmArDmg4,DonaldJTrumpJr
13,2021-12-08 23:57:36+00:00,1468731520819019784,"I would say that the only masterclass Hillary Clinton is qualified to teach is one on how to never become President of the United States, but she’s probably qualified to teach one on how Epstein totally “killed himself” too 😉🤣 https://t.co/zCfjVTBWjy",DonaldJTrumpJr
14,2021-12-08 22:39:41+00:00,1468711911873298432,"The FDA saying it needs 75 years to fully release vaccine data is not a great way to sell the vaccine to those who are skeptical. Why on earth would it take this long?

FDA Says It'll Take 75 Years to Fully Release Pfizer Vaccine Data https://t.co/zDWxmxjtlz",DonaldJTrumpJr
15,2021-12-08 14:36:13+00:00,1468590242739404807,"Liz Cheney stands with Pelosi and Biden, not Wyoming.

@HagemanforWY will defend Wyoming against Pelosi, Biden and the radical left, instead of colluding with them!!! https://t.co/3KvGPlqVvl",DonaldJTrumpJr
16,2021-12-08 00:07:20+00:00,1468371581219053568,"Winning by 38 seconds! Crushing records! Proud of my alma mater for using that Wharton ingenuity to figure out how to dominate women’s sports!

ALWAYS INNOVATE! https://t.co/blS5MUNIRA",DonaldJTrumpJr
17,2021-12-07 23:16:25+00:00,1468358765833555969,Seems the norm at CNN is for their “reporters” to insert themselves into the story to change it for the benefit of their narrative. They are the fakest of the fake news. https://t.co/TqTHwnzfd5,DonaldJTrumpJr
18,2021-12-07 23:14:05+00:00,1468358180732379143,Personally signed and customized Christmas/Hanukkah/Kwanza copies of  LIBERAL PRIVILEGE. Signed by me made out to your MAGA loved ones for the holiday of your choosing. Check it out!!! https://t.co/eoBwcfjj3j,DonaldJTrumpJr
19,2021-12-07 16:06:23+00:00,1468250544036888581,Instant Meme. https://t.co/L0oWeODOnA,DonaldJTrumpJr
20,2021-12-07 14:19:37+00:00,1468223676126580738,In all fairness only Idiot Democrats and The Hollywood elite actually believed him. https://t.co/EPypJe72f4,DonaldJTrumpJr
21,2021-12-07 13:49:27+00:00,1468216086797635588,"Are there people human anymore or have they morphed into the robots they want us to all become?

If you blindly follow along like lemmings you too can have a quite fulfilling and relatively satisfactory holiday season. https://t.co/c1cO6XPs75",DonaldJTrumpJr
22,2021-12-05 15:10:31+00:00,1467511708549890053,What really makes me laugh is thinking about girls on the team who probably spew anti-MAGA stuff all day (as per the rules of woke edu) and then one day wake up to a former dude being on their team and kicking their ass. https://t.co/RmitaN36UH,DonaldJTrumpJr
23,2021-12-05 15:05:14+00:00,1467510381144911881,I trust @joerogan much more than I trust Anthony Fauci.,DonaldJTrumpJr
24,2021-12-05 14:16:07+00:00,1467498018954006529,"Where’s the lie? After 20 years in Afghanistan Millet essentially “couldn’t have seen this coming”

After 20 years you’d have to be a moron… literally any boots on the ground guy saw it coming but not him. He was too busy studying CRT to worry about winning wars. https://t.co/lxX1IDp0Mj",DonaldJTrumpJr
25,2021-12-04 18:54:17+00:00,1467205636509347857,"So no one, exactly ZERO people, have died from the new variant according to the WHO, but we are going to implement draconian panic measures across the world just in case. 

Does anyone else feel like this is much more about control that health? https://t.co/8OLiXVY21l",DonaldJTrumpJr
26,2021-12-04 17:30:47+00:00,1467184623088250890,Very proud of my alma mater for doing so much for women’s sports🙄 https://t.co/RmitaN36UH,DonaldJTrumpJr
27,2021-12-04 17:13:48+00:00,1467180346143817733,"Talk to your boy Fauci. Seems your hero was behind that one as well. 
Not sure he’s ever gotten anything right, but he will keep his job being China’s dream come true. https://t.co/zHg8J9QL9h https://t.co/LLF6z9FMfj",DonaldJTrumpJr
28,2021-12-04 17:02:30+00:00,1467177505740267520,Anthony,DonaldJTrumpJr
29,2021-12-04 16:10:22+00:00,1467164383176531978,I trust @joerogan much more than I trust Anyhony Fauci.,DonaldJTrumpJr
30,2021-12-03 20:11:02+00:00,1466862560314069008,What could go wrong? https://t.co/JWrnZY30Rd https://t.co/gLJJBH1JIc,DonaldJTrumpJr
31,2021-12-03 18:47:10+00:00,1466841455100678149,Wondering why you morons didn’t pull back a bit further? Since others may be fooled by your nonsense here’s a bigger picture. That $.10 savings is a bit like the $.16 everyone saved on their 4th of July BBQ you patronizing pricks! https://t.co/WeixBtYfZF https://t.co/4uREhBmijs,DonaldJTrumpJr
32,2021-12-03 16:43:42+00:00,1466810386645233675,"Given how terrible Biden sounds right now I’m wondering when the 25th Amendment talks will start?

If Trump slightly mispronounced some obscure country in the middle of nowhere they brought up the 25th amendment… Joe Biden can barely get through a sentence.",DonaldJTrumpJr
33,2021-12-03 16:34:11+00:00,1466807990967808004,"As usual, the difference between a conspiracy theory and the truth is about 6 months.

In this case, it seems the “elite pedophile rings” conspiracy ain’t much of a conspiracy after all… but we all knew that already… now there’s just proof. https://t.co/y3mzRlQ7Wr",DonaldJTrumpJr
34,2021-12-03 16:22:18+00:00,1466804999711825927,What’s the over under on this? https://t.co/1EN5iS8hoy,DonaldJTrumpJr
35,2021-12-03 15:23:56+00:00,1466790312018337796,It’s only a matter of time. https://t.co/TUqBjZrOHj,DonaldJTrumpJr
36,2021-12-02 21:32:36+00:00,1466520700580151303,"Exclusive: Trump Already Sold 100,000 Copies of Book, 50 Times More than Chris Christie Book https://t.co/X2dY0n5tRn",DonaldJTrumpJr
37,2021-12-02 16:34:13+00:00,1466445610563813376,The clown show continues. https://t.co/pKYHzfpEeF,DonaldJTrumpJr
38,2021-12-02 00:46:58+00:00,1466207227178622978,Amazing!!!! https://t.co/bIucESksYo,DonaldJTrumpJr
39,2021-12-01 21:14:11+00:00,1466153677291507720,Thread! https://t.co/H9xKSKdv7w,DonaldJTrumpJr
40,2021-12-01 17:17:57+00:00,1466094227058827274,"On the first day of Christmas, my true love gave to me: an indefinite Cuomo suspension and a partridge in a pear tree.",DonaldJTrumpJr
41,2021-12-01 15:33:15+00:00,1466067880932487181,"Are there still Cuomosexuals out there?
#Cuomo",DonaldJTrumpJr
42,2021-12-01 13:47:47+00:00,1466041336562425866,So Juicy actually did a dress rehearsal and still it was so obvious to anyone that it was BS. Amazing. https://t.co/PySJpoauuW,DonaldJTrumpJr
43,2021-12-01 13:08:19+00:00,1466031404836438019,The good thing about the brothers Cuomo having a lot of free time on their hands is now they’ll finally be able to figure out which one is actually  Fredo.,DonaldJTrumpJr
44,2021-11-30 00:22:22+00:00,1465476259270606857,IT'S HAPPENING! Thousands of copies of my fathers latest book have left the printer and are on their way to distribution centers. PROUDLY PRINTED IN AMERICA! Get your copy now https://t.co/j1qBeNygFO https://t.co/yBVTveRHty,DonaldJTrumpJr
45,2021-11-29 14:39:02+00:00,1465329459976974343,Want to drive the leftist hater in your life crazy? Check out the cyber Monday deals and take 30% off with code: FREEDOM30 https://t.co/shHvGUZtNn https://t.co/Hbt7codeTW,DonaldJTrumpJr
46,2021-11-29 14:20:05+00:00,1465324691141312517,"10% for the big guy folks.

Joe Biden was involved with a deal with a Chinese giant — and was expecting a 10% cut! I’m shocked. 

https://t.co/uQhrM5yiHO",DonaldJTrumpJr
47,2021-11-29 13:03:55+00:00,1465305525399269378,A car didn’t drive through the city Christmas parade… a piece of shit drove a car through a Christmas parade weaving in and out to hit as many people as possible. Imagine what they’d be doing if this guy was a conservative and a Trump supporter? https://t.co/gVxEcYvOqQ,DonaldJTrumpJr
48,2021-11-29 00:22:36+00:00,1465113931857510410,"Hey guys, you dont want to miss an amazing interview, tonight 8pm ET on Fox News. An Entire hour, the great one @marklevinshow, with President Donald Trump on his presidency and his new book… dont forget to get a copy for yourself on https://t.co/mhwWAhyWAT https://t.co/CmF2SJK1he",DonaldJTrumpJr
49,2021-11-28 23:10:13+00:00,1465095715965870088,"All of this was shared extensively with the media prior to the election. They couldn’t be bothered, choosing instead to collude with Big Tech to silence anyone who simply published the facts.
Hunter agreed to spread Chinese influence for $10 MILLION a year https://t.co/iM3gU4AJ1U",DonaldJTrumpJr
50,2021-11-28 19:04:31+00:00,1465033881447542786,OMG! Remember those $450k payments to illegal aliens? House Democrats just voted to make them law and the media is covering it up. We need to WAKE UP and stop this bill in the Senate NOW!!! https://t.co/NoFJ82zjXZ,DonaldJTrumpJr
51,2021-11-28 14:54:27+00:00,1464970951754399745,Our Journey Together.  https://t.co/IFOaziN3px,DonaldJTrumpJr
52,2021-11-27 03:16:54+00:00,1464433019662606338,As far as I’m concerned the original will always be the Xi variant. https://t.co/tm8EWcmq3A,DonaldJTrumpJr
53,2021-11-26 01:38:14+00:00,1464045800057622529,You’re welcome. Happy Thanksgiving. https://t.co/mTO5sfHu5J,DonaldJTrumpJr
54,2021-11-25 17:09:00+00:00,1463917650074034182,Well close enough Joe. #Thanksgiving https://t.co/O2CMRcGqmO,DonaldJTrumpJr
55,2021-11-25 16:03:02+00:00,1463901049207537665,"Want a great holiday gift for the Trump Lover in your life? Well here it is. 
You’re Welcome. 

Our Journey Together: Donald J. Trump: 9781735503721: https://t.co/sW0F0ftiJ1: Books https://t.co/AfoUZPxYR9",DonaldJTrumpJr
56,2021-11-24 12:43:33+00:00,1463488457062301696,Now available on Amazon! Our Journey Together: Donald J. Trump: 9781735503721: https://t.co/sW0F0fbHkr: Books https://t.co/TdOHqTzN24,DonaldJTrumpJr
57,2021-11-24 04:40:40+00:00,1463366937065390085,GOATs https://t.co/Yjr72unlvE,DonaldJTrumpJr
58,2021-11-23 17:07:19+00:00,1463192451108253718,The Dollar 25 Store doesn’t have the same ring to it. Thanks Democrats! https://t.co/wIz2sF10Ak,DonaldJTrumpJr
59,2021-11-22 15:18:21+00:00,1462802640836960259,In Joe Biden’s/Democrat America serial pedophiles like Joseph Rosenbaum and other serial offenders like the Waukesha attack terrorist get the benefit of the doubt &amp; are free to roam the streets while Dems want to throw 17 y/o good samaritans like Kyle Rittenhouse away for life.,DonaldJTrumpJr
60,2021-11-21 21:38:07+00:00,1462535822230573058,"Joseph Rosenbaum, who Democrats affectionately refer to as “JoJo”  molested &amp; anally raped 5 boys as young as 9 years old.

I can assure you the world is a better place without him, and only a sociopath would mourn his loss in another attempted assault on a child. Yet here we are",DonaldJTrumpJr
61,2021-11-21 17:21:03+00:00,1462471128128135172,"You have to wonder why so many Hollywood actors are so supportive of convicted pedophiles and abusers…

Just kidding, you don’t have to wonder, you know exactly why! https://t.co/msnXZjpEgM",DonaldJTrumpJr
62,2021-11-21 16:51:22+00:00,1462463659729244165,Because nothing screams Social Justice quite like a new pair of free Yeezies. https://t.co/rITbG3WBFr,DonaldJTrumpJr
63,2021-11-21 16:27:37+00:00,1462457682317570048,"Sick and disturbing that out law enforcement agencies have been weaponized this way against parents rightfully concerned about their children’s futures and conservatives more generally, while pedophiles somehow roam the streets armed &amp; rioting. I guess the left protects its own. https://t.co/ZqvGSpAv0F",DonaldJTrumpJr
64,2021-11-21 15:33:24+00:00,1462444037525446665,I’m old enough to remember when Democrats wouldn’t go all in to defend a N-Word screaming 5 time child rapist pedophile… but apparently this is the new Democrat Party.,DonaldJTrumpJr
65,2021-11-21 14:59:00+00:00,1462435380238721027,If only the left was as concerned about our southern border as they seem to be about the interstate borders within our own country we’d be able to solve a major humanitarian crisis in minutes.,DonaldJTrumpJr
66,2021-11-21 14:42:57+00:00,1462431343296536588,Worth the read. Something about the whole Rittenhouse situation that has been lost in the noise.  https://t.co/n2cVbjJ0Yt,DonaldJTrumpJr
67,2021-11-21 13:59:12+00:00,1462420331667152899,"Some of the most fun I’ve had over the last few months was going through the captions for this amazing book with 45. Funniest commentary ever!!!

Exclusive — ‘She’s F’ing Crazy’: Trump Slams Pelosi in Photo Book https://t.co/CnM49H0Yh3",DonaldJTrumpJr
68,2021-11-21 03:58:24+00:00,1462269135140765702,@DarryLicht Yeah he didn’t shoot anyone he just drowned a woman in a car no problem right?,DonaldJTrumpJr
69,2021-11-21 03:52:26+00:00,1462267633714089986,"This is the left. Using cutesy nicknames for multiple-time convicted child molesters.

“JoJo“ is a POS pedophile who sexually assaulted five young boys between the ages of 9 and 11 &amp; somehow got out of jail, but he’s a really good dude who’s just misunderstood. Fuck these people. https://t.co/fnZShJcN81",DonaldJTrumpJr
70,2021-11-21 03:47:12+00:00,1462266317021474821,Now do Ted Kennedy. https://t.co/uq7Df5lLMP,DonaldJTrumpJr
71,2021-11-20 23:04:07+00:00,1462195079699906568,"Leave it to one of the Dem activists over at the Daily Beast to compare MSNBC following the juror bus around without permission to Tucker being given permission by the defense to embed with them. 

🤡🤡🤡 https://t.co/7lkHLeDalR",DonaldJTrumpJr
72,2021-11-20 19:02:54+00:00,1462134375181475842,Reliable sources tell me this is an actual photo from Joe Biden’s colonoscopy yesterday. I’m not sure but it looks legit. https://t.co/xWJSJ5T916,DonaldJTrumpJr
73,2021-11-20 18:26:58+00:00,1462125331444232192,Must read. https://t.co/UEquwilm01,DonaldJTrumpJr
74,2021-11-20 17:14:40+00:00,1462107136658317316,"The people who were shot were armed rioters attacking a 17 year old who was cleaning up graffiti earlier in the day, while their buddies burned half the town. That’s not peaceful protesting you f-ing morons, but I guess China sent you their talking points so you’ll run with them. https://t.co/mVPi0Od4dR",DonaldJTrumpJr
75,2021-11-20 15:20:47+00:00,1462078474596798468,"Aggressive, but not wrong. https://t.co/LFjcqJMVag",DonaldJTrumpJr
76,2021-11-20 15:18:24+00:00,1462077878162624514,Nailed it. https://t.co/Ot4UrxxNlp,DonaldJTrumpJr
77,2021-11-20 13:03:05+00:00,1462043824902049792,"Breaking: Kyle Rittenhouse found guilty of murdering prosecutors career.

Don’t worry folks even though it looked like he withheld evidence, lied repeatedly, &amp; didn’t have a basic understanding of the law I’m sure he will end up on CNN in the very near future as a “legal analyst”",DonaldJTrumpJr
78,2021-11-20 12:05:23+00:00,1462029301289824259,Have a great weekend folks. https://t.co/g1xjKBqoZ1,DonaldJTrumpJr
79,2021-11-20 00:42:11+00:00,1461857370032816138,"You spent your “career,” mass incarcerating the black Americans you pretend to champion.

A leader here would say that a jury of his peers, under intense scrutiny, did the difficult civic duty of rendering a unanimous verdict based on evidence, not politics &amp; media histrionics. https://t.co/DVcwAxp5q8",DonaldJTrumpJr
80,2021-11-19 23:31:32+00:00,1461839591430754306,CNN and MSNBC were at first unhinged but they clearly got the call from the top to cool it. The tone totally changed after the first hour. Guess they don’t need/want riots with Democrats in charge and polling the way they’re polling… unlike last year.,DonaldJTrumpJr
81,2021-11-19 20:10:28+00:00,1461788990235885571,"Yet another sign that if democrats remain in power in any office anywhere, nobody is safe from aggressive unjust endless persecution. Throw them all out. https://t.co/zgSLw9mBFQ",DonaldJTrumpJr
82,2021-11-19 19:35:13+00:00,1461780119585005568,Patiently waiting for Lebron James’ inevitable dumb as shit take on todays verdict.,DonaldJTrumpJr
83,2021-11-19 18:58:55+00:00,1461770983207931907,The Rittenhouse jury just gave Biden his second colonoscopy of the day.,DonaldJTrumpJr
84,2021-11-19 13:23:06+00:00,1461686471383945218,"YUGE NEWS! A new book by President Donald Trump is being published! Coming out next month: Our Journey Together. A beautiful 300+ page color, coffee table style. Read all about it from @SecretsBedard 
https://t.co/N3kMuSdTuW",DonaldJTrumpJr
85,2021-11-19 12:39:24+00:00,1461675473482792973,"Time to fight back against woke corporations like @jpmorgan/@Chase that discriminate against conservatives!!!

Conservative PAC Cancels Event With Trump Jr. After JPMorgan Chase Subsidiary Cuts Ties With Group, Then Backpedals

https://t.co/MKARnlDywZ",DonaldJTrumpJr
86,2021-11-19 00:17:36+00:00,1461488793383489540,To influence their decision-making by letting it be known that the media was stalking them and ready to ruin their lives at a moment’s notice? These people are genuinely sick and evil.,DonaldJTrumpJr
87,2021-11-19 00:17:35+00:00,1461488791131242496,"“Freelancer” was following jurors on MSNBC’s orders, but not planning to talk or take their photos? So what was the purpose? To make sure to get  their identities to harass them after doing their civic duty? https://t.co/Hi0kFAD6rN",DonaldJTrumpJr
88,2021-11-18 18:59:55+00:00,1461408847176867840,"MSNBC CROSSED STATE LINES!!!

#LockThemUp https://t.co/ej8Ut4qh00",DonaldJTrumpJr
89,2021-11-18 17:10:25+00:00,1461381289047699456,Good thing the NFL is really focused on vaccines for some of the fittest people in the world and not the systemic abuse so prevalent with so many of its active and former players. https://t.co/3idG755RsR,DonaldJTrumpJr
90,2021-11-18 15:11:27+00:00,1461351351892385797,"Joe Rogan blasts media coverage of Rittenhouse case: 'This is a left-wing cult'

https://t.co/8HFLMGc5OY",DonaldJTrumpJr
91,2021-11-18 15:02:04+00:00,1461348989643624449,Because it obviously is. https://t.co/qLHxf1iEFF,DonaldJTrumpJr
92,2021-11-18 04:01:35+00:00,1461182773327278081,What did he think about you marrying your brother? https://t.co/7ihbwa0oOL,DonaldJTrumpJr
93,2021-11-18 03:53:00+00:00,1461180612283351047,Want a perfect surprise for your favorite lib relative this Thanksgiving? Check these out. Make a statement without saying a word.🤣🤣🤣 https://t.co/BFLs6boLop https://t.co/VD7kRdjQRI,DonaldJTrumpJr
94,2021-11-17 00:44:28+00:00,1460770779084296197,Checks out! https://t.co/GDD2hnwsox,DonaldJTrumpJr
95,2021-11-17 00:28:00+00:00,1460766638412910593,Because “fact-checking” is really about censoring and not really about facts! It’s a 3rd party racket used by social media to keep their distance in the silencing of millions of conservatives since the checking only seems to go one way. https://t.co/zro2Ds7z7b,DonaldJTrumpJr
96,2021-11-16 21:32:40+00:00,1460722512371793932,Doesn’t this mean that the attorney general of United States lied to the American people under oath? https://t.co/LXZmmvaBzX,DonaldJTrumpJr
97,2021-11-16 13:29:20+00:00,1460600876188508172,"Yikes!!!

""The Wyoming Republican Party voted on Saturday to no longer recognize Democrat-allied Rep. Liz Cheney (R-WY) as a Republican.""

https://t.co/NTkAGSmQog",DonaldJTrumpJr
98,2021-11-16 01:16:17+00:00,1460416399730528259,It’s getting worse every day https://t.co/beJw2dMylW,DonaldJTrumpJr
99,2021-11-15 23:42:33+00:00,1460392812072120320,But Brandon insisted this was going to cost $0. https://t.co/7R0vUVQjjm,DonaldJTrumpJr
100,2021-11-15 23:33:47+00:00,1460390604383338502,Worth the read. Thread https://t.co/yqbQ0ip1jW,DonaldJTrumpJr
101,2021-11-15 23:23:29+00:00,1460388012110622723,This will be awkward! https://t.co/4bsNybJ5qs,DonaldJTrumpJr
102,2021-11-15 22:59:50+00:00,1460382061164961794,Muppets have races now? So based on the orange I’m guessing Ernie is a Trump and must be cancelled immediately!!! https://t.co/yTt62OwSau,DonaldJTrumpJr
103,2021-11-15 22:20:42+00:00,1460372213161414657,"Yea the prosecutor, who seems to not know much about law or is lying to the jury on purpose, has really shitty trigger discipline. https://t.co/446Hmixxa5",DonaldJTrumpJr
104,2021-11-15 21:48:28+00:00,1460364100861501441,@SinklarD @braxton_mccoy I took my son there at age 5 for his first real outdoor adventure. Have to make sure that the fishery is still there years from now so he can do the same with his son one day.,DonaldJTrumpJr
105,2021-11-15 21:45:14+00:00,1460363287493693443,@scoobs2254 @braxton_mccoy @kimguilfoyle True and true. Thanks for understanding that.,DonaldJTrumpJr
106,2021-11-15 20:40:56+00:00,1460347106854588421,@SinklarD @braxton_mccoy Thanks for pointing that out.  Glad I could help on that one.,DonaldJTrumpJr
107,2021-11-14 18:45:19+00:00,1459955623307665421,"If Kyle Rittenhouse is a white supremacist, like the Democrats/Media have so desperately portrayed him, why’d he only shoot white people in self defense? Why do the vast majority of people not know that minor detail?",DonaldJTrumpJr
108,2021-11-14 16:26:36+00:00,1459920712706232325,"Remember folks, this is what they think of you. They can destroy our economy and you’ll all be just fine. https://t.co/P1G8TM55NT",DonaldJTrumpJr
109,2021-11-14 16:20:09+00:00,1459919090462691334,Wasn’t it his experts that made the decisions they got us here? Democrat policy is why we are where we are and why it’s going to get worse until we stop electing Democrats. https://t.co/aqFB5Wz7EB,DonaldJTrumpJr
110,2021-11-14 16:09:28+00:00,1459916400374472707,Leave it to the Democrat thought leaders of “the squad” to leave out the details to try to tar &amp; feather a 17 y/o at trial. BTW if you’ve been watching the Dem/Media narrative has been collapsing disastrously… Democrats should be ashamed of themselves and what they’ve become. https://t.co/mhXX78Iqj7,DonaldJTrumpJr
111,2021-11-13 15:54:42+00:00,1459550298649907202,Flagging for you @stoolpresidente https://t.co/Bihb9pnPrC,DonaldJTrumpJr
112,2021-11-13 14:42:34+00:00,1459532141738479620,Solid point. https://t.co/XelWvZ1M83,DonaldJTrumpJr
113,2021-11-12 21:26:45+00:00,1459271473156304899,They’re not doing anything about it for a reason folks. https://t.co/ObkS4MXqNX,DonaldJTrumpJr
114,2021-11-12 21:18:20+00:00,1459269354579804160,Saying the quiet part out loud. They’re openly admitting that they prosecute their political enemies when in office. https://t.co/PAaJfUlvJt,DonaldJTrumpJr
115,2021-11-12 19:48:14+00:00,1459246680524603394,I’d like him to be treated the way they would treat Kyle Rittenhouse if he perjured himself… but you know they won’t as there are two different set of rules. One for conservatives and one for leftist garbage. https://t.co/LNX3B0BWNa,DonaldJTrumpJr
116,2021-11-12 18:48:09+00:00,1459231558125162496,Seems like it would be only fair given it was their misguided/misinformed outrage that forced these insane charges to begin with. https://t.co/KITCtOFf3N,DonaldJTrumpJr
117,2021-11-12 18:44:00+00:00,1459230516155232264,What could go wrong? OMG! https://t.co/r4vaw4NmfO,DonaldJTrumpJr
118,2021-11-12 16:36:06+00:00,1459198327615012875,Liz Cheney is using her position of power on the J6 sham committee to bully and intimidate her political enemies. Wyoming can do so much better than this born and raised Virginia RINO! https://t.co/vPzC7Lsozh,DonaldJTrumpJr
